,Author,Poem
0,"Aburto Uribe,Teresa",A Neruda
1,"Aburto Uribe,Teresa","Te Doy, En Este Papel"
2,"Aburto Uribe,Teresa",Acaso Fue La Tarde
3,"Aburto Uribe,Teresa","Podré, Quizás, Distanciarme En El Tiempo"
4,"Aburto Uribe,Teresa",Cuando El Silencio De Las Noches
5,"Aburto Uribe,Teresa",Algún Día Me Iré... Pero Aquí Quedaré
6,"Aburto Uribe,Teresa",Andaré Los Caminos Buscando El Horizonte
7,"Aburto Uribe,Teresa",Aquel Puerto Solo
8,"Aburto Uribe,Teresa",Aquí Te Espero
9,"Aburto Uribe,Teresa",Basta Mirar Tus Ojos
10,"Aburto Uribe,Teresa",Rodeados Por La Quietud De La Noche
11,"Aburto Uribe,Teresa",Ese Otro Ser
12,"Aburto Uribe,Teresa",Recuerdos
13,"Aburto Uribe,Teresa",Cuando Se Tiene Un Amigo
14,"Aburto Uribe,Teresa",De Esas Tres Cosas
15,"Aburto Uribe,Teresa",Rutina
16,"Aburto Uribe,Teresa",Deseo De Libertad
17,"Aburto Uribe,Teresa",Dulce Soledad Que Me Acompañas
18,"Aburto Uribe,Teresa",El Eco De Mi Voz
19,"Aburto Uribe,Teresa",Extraña Manera De Amar
20,"Aburto Uribe,Teresa",Esto Que Ves Soy Yo
21,"Aburto Uribe,Teresa",Me Gusta Tu Silencio
22,"Aburto Uribe,Teresa","No Me Quiero Ir, Estar Apenas"
23,"Aburto Uribe,Teresa",No Sé Qué Me Une Al Cielo-Decías
24,"Aburto Uribe,Teresa",Nostalgias De Puerto
25,"Aburto Uribe,Teresa",Y Luego Nada
26,"Aburto Uribe,Teresa",Te Necesito Amiga
27,"Aburto Uribe,Teresa",Pensarás Tú
28,"Aburto Uribe,Teresa","Podré, Quizás, Elevarme Al Infinito"
29,"Aburto Uribe,Teresa",Si Escuchas Una Tarde
30,"Aburto Uribe,Teresa",Si Me Quieres...
31,"Aburto Uribe,Teresa",Si Yo Tuviera Coraje
32,"Aburto Uribe,Teresa",Tiempo Sin Memoria
33,"Aburto Uribe,Teresa",Tengo Miedo De No Volver A Verte
34,"Aburto Uribe,Teresa",Volveré Una Tarde De Septiembre
35,"Aburto Uribe,Teresa",Volé En Tu Recuerdo
36,"Aching Samatelo,César",Anoche Soñé Que No Existía
37,"Aching Samatelo,César",De Entre Las Piedras Y El Musgo
38,"Aching Samatelo,César",Una Hoja De Parra Se Aleja Flotando Sobre Las Aguas De Un Río
39,"Aching Samatelo,César",Una Hoja De Parra Se Aleja Flotando Sobre Las Aguas De Un Río
40,"Aching Samatelo,César",Tan Quieto El Mar
41,"Aching Samatelo,César",La Luna Y El Poeta
42,"Aching Samatelo,César",Si Tan Sólo Fuera Fácil
43,"Aching Samatelo,César",Parado Estupefacto Frente Al Fuego
44,"Aching Samatelo,César",Mujer
45,"Aching Samatelo,César",Tristeza
46,"Aching Samatelo,César",Te Doy Mi Hoy
47,"Aching Samatelo,César",Te Habrás Preguntado Por Qué No Desisto
48,"Acosta Sánchez,Juan Felipe",El Amor
49,"Acosta Sánchez,Juan Felipe",En Una Balacera De Palabras
50,"Acosta Sánchez,Juan Felipe",Por Los Otros
51,"Acosta Sánchez,Juan Felipe","Tu Dulzura Me Transporta, Me Lleva"
52,"Acosta Sánchez,Juan Felipe",Quiso Aumentarme
53,"Adames,Roberto José",Llueve
54,"Adames,Roberto José",Mi Ojo Inútil
55,"Adrados Maestre,Enrique",Elegía Al Perro De Un Amigo
56,"Adrados Maestre,Enrique",Elegía Al Gato
57,"Adrados Maestre,Enrique",Nostaljia Ii
58,"Adrados Maestre,Enrique",Veo Un Castillo
59,"Adrados Maestre,Enrique",Solamente Palabras Me Acompañan
60,"Adrados Maestre,Enrique",Mariposa Amarilla
61,"Adrados Maestre,Enrique",Romance Oscuro Del Caminante
62,"Adrados Maestre,Enrique",...Y El Arte Es Compuesto Por Ti
63,"Adrados Maestre,Enrique",Siento Decirte Que Anoche
64,"Adrados Maestre,Enrique",Recuerdos De Otros Tiempos
65,"Adrados Maestre,Enrique",Somos Los Hijos De La Roca Madre
66,"Adrados Maestre,Enrique",¿Vida Igual A Muerte?
67,Aguijonmagico,Rechazo
68,Aguijonmagico,Vivo Solo En Un Planeta Abandonado
69,"Aguilar Martínez,Luis",Mantel De Tulipanes Amarillos Viii
70,"Ainchil,Claudia",¿Es Tarde? Pregunto
71,"Ainchil,Claudia",Los Adioses Como Venas Silenciosas
72,"Ainchil,Claudia",En Combate
73,"Ainchil,Claudia",Será Que Estoy Un Poco Húmeda
74,"Akinin Levy,Samuel",Divagancias De Tercera Edad
75,"Akinin Levy,Samuel",Me Da La Impresión De Que No Sé Querer
76,"Akinin Levy,Samuel",Forjando Nuevos Caminos
77,"Akinin Levy,Samuel",Son Muchas Las Veces En Las Que La Angustia Nos Hace Ver El Panorama De Otro Modo
78,"Akinin Levy,Samuel",Romper Un Amor
79,"Al Haded,Alí",La Voz Del Mar
80,"Al Haded,Alí",Un Chagall
81,"Al Haded,Alí",Mi Tierra
82,"Al Haded,Alí",Mi Amor... ¡Por Una Rosa!
83,"Al Haded,Alí",Beso Lánguido Del Sol Sobre La Panza
84,"Al Haded,Alí",Los Alerces Y Heráclito
85,"Al Haded,Alí",Soneto Para Mi Amada (Nina De L´Amore)
86,"Al Haded,Alí",Un Haz De Luz Que Se Filtra Por La Balaustrada De Los Pinos
87,"Al Haded,Alí",El Segmento Lapidario
88,"Al Haded,Alí",Romance Del Bosque Y La Niña Pobre
89,"Al Haded,Alí",Hombre De Mar
90,"Al Haded,Alí",Sobre La Horqueta De La Rama Añeja
91,"Al Haded,Alí",Palabras De Un Poeta
92,"Al Haded,Alí",Las Mil Batallas Del Coronel Y Una Sola Huella
93,"Al Haded,Alí",La Sed Del Corsario Sajón
94,"Al Haded,Alí",Un Sueño Y Una Pasión
95,"Al Haded,Alí",Escribiré Sonetos En El Viento
96,"Al Haded,Alí","Piruetas, El Payaso Trapecista"
97,"Al Haded,Alí",Las Autistas Agujas De Un Cuadrante
98,"Al Haded,Alí",Regaré Con Mis Lágrimas ¡Oh Madre! El Jardín
99,"Al Haded,Alí",Si Se Roban La Luna Los Corsarios
100,"Al Haded,Alí",Yace Su Mirada Continental
101,"Alba,Juan Luis",Ya Dora El Suave Terciopelo
102,"Alba,Juan Luis",Sin Retorno
103,"Albaíno,Genaro",En Medio De Esta Casualidad
104,"Albaíno,Genaro",He Logrado Des-Armar
105,"Albaíno,Genaro",Nací En Pudahuel
106,"Albaíno,Genaro",Huelgan Las Presas
107,"Albaíno,Genaro",Maldita Poesía
108,"Albaíno,Genaro",Vieja Lámpara
109,"Albaíno,Genaro",Yo No Vendo Mis Ojos Negros
110,"Alberca,Marta",Tras Meses De Ausencias
111,"Alberca,Marta",Compartimos Una Hija
112,"Alberca,Marta",Los Primeros Rayos
113,"Alberca,Marta",Recuerdo Mis Primeras Gafas
114,"Alberca,Marta",Tu Infancia Es Un Regalo
115,"Alcántara Fernández,Orlando",¡Abracadabra!
116,"Alcántara Fernández,Orlando",Incógnito Mi Amor Se Revela Pleno
117,"Alcántara Fernández,Orlando",Pendón E Ignominia
118,"Alcántara Fernández,Orlando",Ese Amor Vuelto Llamas
119,"Alcántara Fernández,Orlando",¿Qué Animal Soy Yo Que Me Desvelo?
120,"Alcántara Fernández,Orlando",Hay Una Muerte Inédita
121,"Alcántara Fernández,Orlando",Jehováh-Yavéh: Dios Grácil
122,"Alcántara Fernández,Orlando",Padre Nuestro Que Estás En La Biblia
123,"Alcántara Fernández,Orlando",Sin Rubor Por Ti Defino El Amor
124,"Alcántara Fernández,Orlando",Si Algún Día Te Escribo Un Poema
125,"Alcántara Fernández,Orlando",¡Qué Profesión Más Hermosa
126,"Alcántara Fernández,Orlando",Te Amo Adrede
127,"Alfaro Velásquez,Carlos E.",Penélope
128,"Almagro,Ramón de",Como Un Pájaro
129,"Almagro,Ramón de",... Y Entonces Tú Me Hablarás
130,"Almagro,Ramón de",El Velero Blanco
131,"Almagro,Ramón de",La Niña Sentada A Orillas Del Lago
132,"Almagro,Ramón de",Me Han Tirado Un Beso Esta Mañana
133,"Almagro,Ramón de",Picoteando La Cáscara
134,"Almagro,Ramón de",Tú Puedes Olvidar Y Los Recuerdos
135,"Almagro,Ramón de",Quiero Palmar Cerca Del Obelisco
136,"Almagro,Ramón de",Tu Espalda Es Mi Descanso Mi Sosiego
137,"Alonso,Patricia",Mi Familia
138,"Alonso Rodríguez,Blanca-María","¿Por Qué, Señor, He De Esperar Al Día"
139,"Alonso Rodríguez,Blanca-María",—Quiero Pintar Un Beso Redondo Y Grande
140,"Alonso Rodríguez,Blanca-María",Siempre Hilando El Camino
141,"Alonso Rodríguez,Blanca-María","—Quiero Volar Al Cielo, Madre"
142,"Altuzar Suárez,Mario Luis",Es Tan Quejumbroso
143,"Altuzar Suárez,Mario Luis",Se Observa Tan Cerca El Precipicio
144,"Altuzar Suárez,Mario Luis",En El Canto Del Silencio
145,"Altuzar Suárez,Mario Luis",Miro El Espacio Que Me Rodea
146,"Altuzar Suárez,Mario Luis",Plenitud
147,"Altuzar Suárez,Mario Luis",Ofrendado
148,"Altuzar Suárez,Mario Luis",Soplo
149,"Altuzar Suárez,Mario Luis",Resurge En El Paraíso Prometido
150,"Altuzar Suárez,Mario Luis",Qué Absurdos Resultan Los Hombres
151,"Altuzar Suárez,Mario Luis",Los Clandestinos Del Amor
152,"Altuzar Suárez,Mario Luis",Sumergido En La Sinuosidad De Tu Cuerpo
153,"Alvarado,Tito",Fallujah
154,"Álvarez-Hidalgo,Francisco",Perdido
155,"Álvarez-Hidalgo,Francisco","Estoy Deshabitado, Sin Rumores"
156,"Álvarez-Hidalgo,Francisco",Te Siembras En La Noche Y No Germinas
157,"Álvarez-Hidalgo,Francisco","Te Imaginé Primero, Llegó Luego"
158,"Álvarez-Hidalgo,Francisco",Muerta
159,"Álvarez-Hidalgo,Francisco",Reiteración
160,"Álvarez-Hidalgo,Francisco","Mi Río, Mi Torrente"
161,"Álvarez-Hidalgo,Francisco",Turista
162,"Álvarez-Hidalgo,Francisco",Sobre Tu Libro Me Quedé Dormida
163,"Álvarez Bürger,Antonio",Los Dos
164,"Álvarez Bürger,Antonio",Repican Como Golpes De Campana Tus Pesares
165,"Álvarez Bürger,Antonio",Mientras Más Viejo
166,"Álvarez Bürger,Antonio",Simulé Estar Vivo
167,"Álvarez Bürger,Antonio",Qué Perverso Es El Invierno Con Los Árboles
168,"Álvarez Bürger,Antonio",Poesía Amarga
169,"Álvarez Bürger,Antonio",Las Esquinas Son Aladas
170,"Álvarez Bürger,Antonio",Ofrendártelo Todo
171,"Álvarez Bürger,Antonio",Parece Que No Tengo Ya Cristales En Los Ojos
172,"Álvarez Bürger,Antonio",Subes Al Impertérrito Ferrocarril De La Vida
173,"Álvarez,Atilio",La Primera Víctima
174,"Álvarez,Héctor",Me Gustan
175,"Álvarez,Héctor",Hay Una Película
176,"Álvarez,Luis",Poemas Extranjeros
177,"Álvarez,Luis",Poema Para Una Mujer Innombrada
178,"Álvarez,Luis",Por Aquí Llegaro
179,"Álvarez,Luis",Hoy He Vuelto A Ver Amarillos
180,"Álvarez,Luis",He Vuelto Al Lacio
181,"Álvarez,Luis",La Lluvia Golpea Los Cristales
182,"Álvarez,Luis",Escritura Espontánea
183,"Álvarez,Luis",Visto Como Un Canto Sonoro
184,"Álvarez,Luis",Oro Sanjuanino
185,"Álvarez,Luis",Nada Importa Gastar Medio Día
186,"Álvarez,Luis",Isla De Villanos
187,"Álvarez,Luis",Poema Para Una Mujer Desconocida
188,"Alzate López,Alain",Sombra Que En Mis Noches
189,"Alzate López,Alain",Yo No Quiero Que Se Abra
190,"Alzugaray,Juan Leandro",Tu Piel En Mis Manos Es Arcilla
191,"Alzugaray,Juan Leandro","Cada Noche, Mi Amor"
192,"Alzugaray,Juan Leandro",Será Que En Vos Equivoqué El Camino
193,"Alzugaray,Juan Leandro",Noticia De Último Momento 
194,"Alzugaray,Juan Leandro",Un Triste Domingo Más
195,"Alzugaray,Juan Leandro","Parado Aquí, Frente Al Jurado"
196,"Alzugaray,Juan Leandro",Me Gusta Acariciarte Con Mis Palabras
197,"Alzugaray,Juan Leandro",Mi Mundo De Fantasías
198,"Alzugaray,Juan Leandro",Regreso Inesperado
199,"Alzugaray,Juan Leandro",Tu Alma... Mi Hogar
200,"Alzugaray,Juan Leandro",Tu Te Amo Y Mi Te Quiero
201,Amanda,Discurso Natural
202,Amanda,He Elegido Este Camino...
203,Amanda,El Llamado
204,Amanda,Llanto
205,Amanda,De Dónde...
206,Amanda,Reflejos
207,Amanda,Puedo Hacer Temblar Tu Quietud De Siglos
208,Amanda,Me Basta
209,Amanda,Tendría Que Acostumbrarme A La Costumbre
210,Amanda,Quiero
211,Amanda,Una Vez Más
212,"González Ambou,Ramón",La Noche Me Hace Poeta
213,"Amoroso,Alberto Gustavo",Metamorfosis
214,"Amoroso,Alberto Gustavo",Yo Te Transito
215,"Amoroso,Alberto Gustavo",Y Primero Fue El Verbo...
216,"Amoroso,Alberto Gustavo","La Tarde, Niña Aún"
217,"Amoroso,Alberto Gustavo",Un Trozo De Papel
218,"Amoroso,Alberto Gustavo",Superficies
219,"Amoroso,Alberto Gustavo",Geografía
220,"Amoroso,Alberto Gustavo",Tu Presencia
221,"Anadón,Antonio José","Se Aproximan, Me Tientan, Me Seducen "
222,"Andivia,Juan",No Hay Amores Que Matan
223,"Andivia,Juan","Donde Pones Poder, Yo Pongo Olvido"
224,"Andivia,Juan",Como El Agua Te Siento
225,"Andivia,Juan","Tú Y Yo, De La Mano"
226,"Andivia,Juan","Sin Tu Presencia, Se Me Ha Helado El Amor"
227,"Andivia,Juan","Desde Tus Muslos Blancos, Tu Sonrisa"
228,"Andivia,Juan",En El Brocal Del Pozo Mi Alma Se Columpia
229,"Andivia,Juan",No Insistas. Los Porqués De Las Cosas No Se Saben Jamás
230,"Andivia,Juan","Se Declararon Genios, Cambiaron Sus Vestidos"
231,"Andrade,Víctor",Quiero Morir Por Un Momento En Mi Soledad
232,Anna,Química
233,"Ansotegi Suárez,Íñigo J.",No Me Abandones Más
234,"Ansotegi Suárez,Íñigo J.",Presentimiento
235,"Ansotegi Suárez,Íñigo J.",Sin Norte
236,"Ansotegi Suárez,Íñigo J.",Para Anna
237,"Aparicio González,Jesús",La Caza
238,"Aparicio González,Jesús",Los Dones Del Juglar
239,"Aparicio González,Jesús",El Final No Traerá Una Noche Triste
240,"Aparicio González,Jesús",La Gran Noticia Es Ésta
241,"Aparicio González,Jesús",Nunca La Misma Palabra
242,"Aparicio González,Jesús",Ni Seguir Esperanzas Ni Parar Por El Miedo
243,"Aparicio González,Jesús",Un Instante Después De Haberse Muerto
244,"Aparicio González,Jesús",Tú Fuiste Corza Esquiva Huyendo Por El Bosque
245,"Aparicio González,Jesús",Vanas Luces Controlan Y Guardan Nuestras Vidas
246,"Aranda,Ismael",Universo Dadaísta
247,"Aranda,Ismael",Un Protohombre Entra En Un Burdel
248,"Aranda,Ismael",Hoy Soy Como Borges Mirando Por La Ventana
249,"Aranda,Ismael",Un Carro
250,"Aranda,Ismael",Hay Culos Que Te Invitan
251,"Arespacochaga,Joaquín",Un Cofre De Silencios Es El Tiempo
252,"Arespacochaga,Joaquín",Fui El Camino
253,"Arespacochaga,Joaquín",Fluir
254,"Arespacochaga,Joaquín",Tránsito
255,"Arespacochaga,Joaquín",Qué Pocos Los Que Piensan
256,"Arespacochaga,Joaquín",Madrugada De Silencios
257,"Arespacochaga,Joaquín",Invocació
258,"Arespacochaga,Joaquín",Una Hoja
259,"Arespacochaga,Joaquín",Volatería
260,"Arespacochaga,Joaquín",Vencido Entre Las Cosas
261,"Arespacochaga,Joaquín",Quiera El Viento
262,"Arespacochaga,Joaquín",Vuela Hoja Sin Alas
263,"Arespacochaga,Joaquín",Soy De La Vida Tiempo Y Desmemoria
264,"Arespacochaga,Joaquín",Ropa Vieja De Fatigas
265,"Argaya,Miguel","¡Quién, Como Tú, Poblara De Tal Modo La Música"
266,"Argaya,Miguel",Si Fueran Los De Un Puente
267,"Argaya,Miguel",Poeta De Tan Hondo Magisterio
268,"Argaya,Miguel",Registro Civil
269,"Argaya,Miguel",Pulvis Et Umbra 
270,"Asén,Miguel de",Al Final De Mis Días
271,"Asén,Miguel de","Bailo, Tu Talle Acaricio"
272,"Asén,Miguel de",En Mi Cora(Ra)Zón
273,"Asén,Miguel de","Te Vi Caminando, Y No Sola"
274,"Asén,Miguel de",Cielo Lleno De Estrellas
275,"Asén,Miguel de",Testigo De Los Días
276,"Asén,Miguel de","Nada, La Paz Ya Empeñada"
277,"Asén,Miguel de",Paz Para Humanos Sin Espadas
278,"Asén,Miguel de",Dos Poemas Hoy Escribo
279,"Asén,Miguel de",Ecos De Soledad
280,"Asén,Miguel de",Tu Perfume
281,"Asén,Miguel de",Sueño Sin Dueño
282,"Asén,Miguel de",Te Deseo Un Feliz Cumpleaños
283,"Asén,Miguel de",Recorriendo Del Tiempo La Estela
284,"Asén,Miguel de",La Voz Hispana
285,"Asén,Miguel de",Una Línea Que No Quiere Emerger
286,"Asén,Miguel de",Ser Piedra Quisiera Que Nada Siente
287,"Asén,Miguel de",Sentir Es Vivir Sentidos
288,"Asén,Miguel de",¿Qué Queda Si Es Abandono La Vida?
289,"Asén,Miguel de",Tributo Para El Futuro
290,"Asén,Miguel de",Triunfo Mercenario
291,"Asén,Miguel de","Sentimiento, Flor Salvaje"
292,"Asén,Miguel de",Una Flor Entre Brisas Se Encierra
293,"Asén,Miguel de",Si El Mundo Es Tristeza
294,"Asén,Miguel de",Sueños De Ilusión
295,"Asén,Miguel de",Una Voz Atraviesa La Mañana
296,"Azar,Santiago",Domingo De Visitas
297,"Azar,Santiago",Recados Para La Mujer De Los Inviernos
298,"Azar,Santiago",Nos Amamos En Una Bicicleta
299,"Azar,Santiago",Rojos Tus Cabellos
300,"Azar,Santiago","Llora Chileno, Llora De Suelo A Los Ríos"
301,"Azar,Santiago",Se Trata De Arreglar El Mundo Como Lo Hacemos Nosotros
302,"Azar,Santiago",Permiso Poeta
303,"Azar,Santiago",Otra Vez La Lágrima
304,"Azar,Santiago",Cuando El Océano Respire Hondo Sobre Tu Alma
305,"Azar,Santiago",Viejos Cracks
306,"Azar,Santiago",Cuando Llama La Poesía
307,"Azar,Santiago",Vamos A Rajar La Tierra
308,"Azar,Santiago",Desde La Mutilada Memoria Del Verso
309,"Azar,Santiago",Tu Vestido Verde
310,"Azar,Santiago","Gritaba El Niño, Enloquecido"
311,"Azar,Santiago",Todos Querían Ver A Este Muchacho
312,"Azar,Santiago",Me Propongo Muy Fielmente Amar Al Otro
313,"Azar,Santiago",Me Han Llamado
314,"Azar,Santiago",Tambores Por Los Desfiles
315,"Azar,Santiago",Mañana Vendrá El Presidente
316,"Azar,Santiago",Espero Poder Colocar Una Flor
317,"Azar,Santiago",La Pantera De Barro
318,"Azar,Santiago",Recital De Mis Arañas
319,"Azar,Santiago",Happy Birthday
320,"Azar,Santiago",Tengo Tal Vez Diez Años
321,"Azar,Santiago",He Aquí Todo Lo Que Soy Y Seré Por Siempre
322,"Azar,Santiago",Ya En La Cruz Los Tres Condenados
323,"Azar,Santiago",Notas De Protocolo
324,"Azar,Santiago",Los Cinco Niños Del Mar
325,"Azar,Santiago",Mujer De Fuego
326,"Azar,Santiago",Tercer Mundo
327,"Azar,Santiago",Una Mujer Llamada Sola
328,"Azar,Santiago","Otro, Otro Cigarrillo"
329,"Azar,Santiago",Posiblemente Esta Pluma Esté Quebrada
330,"Azar,Santiago",Prometo Ir A Misa Todos Los Domingos
331,"Azar,Santiago",Vas A Ser Mi Náufraga Porque Destrozaré Tu Barca
332,"Azar,Santiago","Soy Poeta, Ave De Rapiña De Todos Los Sentimientos"
333,"Azuela Espinoza,Francisco",El Maldicionero. Poesía En Prosa
334,"Azuela Espinoza,Francisco",Lágrima Seis
335,"Azuela Espinoza,Francisco",En Este Poema De Muertos
336,"Azuela Espinoza,Francisco","En La Sombra De La Vida, Que Es Una Sola, Alta, Profunda Y Misteriosa Cae Un Eco De Destinos Imposibles"
337,"Azuela Espinoza,Francisco",Lágrima Cuatro
338,"Azuela Espinoza,Francisco",Lágrima Dos
339,"Azuela Espinoza,Francisco",Lágrima Cinco
340,"Azuela Espinoza,Francisco",Lleno De Sauces El Tiempo Echa Su Llanto Y Su Asma
341,"Azuela Espinoza,Francisco",Tren De Fuego
342,"Azuela Espinoza,Francisco",Pomona Se Apareció Con Sus Árboles Rotos Y Fríos
343,"Badilla,Sergio",Moustakis Es Alicia En Buenos Aires
344,"Badilla,Sergio",Una Fogarada Dispersa Después De Un Advenedizo Rayo
345,"Badilla,Sergio",Llega Por Fin La Noche
346,"Badilla,Sergio",Mis Pupilas Atrapan Con Dificultad La Profanía Del Tiempo
347,"Badilla,Sergio",Plenilunio
348,"Baier,Carlos",Y Esos Somos Amor Por El Desierto
349,"Baier,Carlos",Y En Este Viaje Que Hago Voy Contigo Amor
350,"Bane,Micky",Pensé Que No Era Posible Ser Iluminado
351,"Barbarito,Carlos","Desde Siempre, Doble: Torbellino"
352,"Barbarito,Carlos",¿En Sueños? Lenta Lluvia De Hojas
353,"Barbarito,Carlos","María Gracia Subercaseaux, Espejo"
354,"Barbarito,Carlos",Nada Salta A La Vista Salvo Alguna Piedra
355,"Barciela,Miguel",Bajando La Pendiente De Tu Vida
356,"Barciela,Miguel",La Muerte
357,"Barciela,Miguel","La Arquitectura De Tu Rostro, En Donde"
358,"Barciela,Miguel",Tu Existencia Pendía De Un Hilo
359,"Barciela,Miguel",La Potencia Que Emana De Tu Rostro
360,"Barciela,Miguel",Lucha De Los Amantes Entregados
361,"Barciela,Miguel",No Desde La Obsesión Por Ti Se Puede
362,"Barciela,Miguel",¿Para Qué Decirte Algo Que Ya Sabes?
363,"Barciela,Miguel",¿Por Qué Me Obligas A Pensar En Ti
364,"Barragán,Nelson",Como Manantial En El Desierto
365,"Barragán,Nelson",Noches De Arrullos
366,"Barragán,Nelson",Noches De Amor Lejano
367,"Barragán,Nelson",Eres Tú La Causa
368,"Barragán,Nelson",Una Nube Blanca
369,"Barragán,Nelson",Susurros
370,"Barrera,Paula",Canción
371,"Barrera,Paula",Tengo Un Hueco En Mi Alma
372,"Barrera,Paula",Tengo Las Manos Congeladas
373,"Barrera,Paula",Nací Sola
374,"Barrero,Hilario",Y Tener Que Explicar De Nuevo El Subjuntivo
375,"Barrero,Hilario",Un Rayo Destruyó
376,"Barrero,Hilario",¿Dónde Están Esos Trenes Que Pasaron
377,"Barrero,Hilario",Al Querer Despertar Y Abrir Los Ojos
378,"Barrero,Hilario",Me Arrimo A Ti
379,"Barrero,Hilario","Única Criatura, La Claridad"
380,"Barrero,Hilario",Todos Vienen Del Ghetto
381,"Barriga Morato,Jesús Ángel",Confío En La Primavera
382,"Barroso,Daniel",El Abasto Es Un Exilio De La Suerte Apostando A Que Te Mueras
383,"Barroso,Daniel",Joven Argentino
384,"Barroso,Daniel",Iman Hejjo
385,"Barrundia Sánchez,Mario",Tus Pechos Fueron Los Volcanes
386,"Barrundia Sánchez,Mario",Ven Esta Noche
387,"Bartha,Gonzalo José",Baldosas Narcotizadas
388,"Bartha,Gonzalo José",Cometemos El Fatal Error De Pretender
389,"Bartha,Gonzalo José",Murmuro Los Últimos Renglones
390,"Bartha,Gonzalo José",El 15 De Diciembre
391,"Bartha,Gonzalo José",En Principio
392,"Bartha,Gonzalo José",Portfolio Con Mi Esposa
393,"Bartha,Gonzalo José",La Gente
394,"Bartha,Gonzalo José",Me Quedan Tres Libros De Poesía
395,"Bartha,Gonzalo José",Vivimos Y Sabemos
396,"Bartha,Gonzalo José",Nuestro Lugar En La Fila
397,"Bartha,Gonzalo José",Sencillamente Eso
398,"Basallote,Francisco",Cuando Llovía
399,"Basallote,Francisco",Soleá
400,"Basallote,Francisco",Si Como Un Reptil
401,"Basallote,Francisco",Impón Tus Manos
402,"Basallote,Francisco",La Ciudad Era Un Cíngulo
403,"Basallote,Francisco",Miércoles
404,"Basallote,Francisco",Ya Es Primavera
405,"Basso,Cristián",Por El Viento Me Conozco
406,"Basso,Cristián",No Quiero El Ruido
407,"Basso,Cristián",Los Cabellos Despedazan El Agua
408,"Basso,Cristián",Los Ojos Amatistas Del Atlántico
409,"Basso,Cristián",Amanecí Llagado
410,"Basso,Cristián",Suben Los Días A Un Dolor Sin Ramas
411,"Basso,Cristián",La Noche Le Hacía Sin Dedos La Luna
412,"Basso,Cristián",No Le Creo A Tu Pasión
413,"Basso,Cristián",Esperanza Del Cacto
414,"Basso,Cristián",Estás Llorando
415,"Basso,Cristián",Encúbreme En El Sueño
416,"Basso,Cristián",Esa Obsesión De Ser Otro Sin Ser Uno
417,"Basso,Cristián",Una Gota Caminaba
418,"Basso,Cristián",Lamer O Lenguarse
419,"Basso,Cristián",Las Abadías Cosen El Adorno De La Noche
420,"Basso,Cristián",Las Tazas Son Los Seres
421,"Basso,Cristián",Ni La Llamarada Para El Solitario
422,"Basso,Cristián",Nuestras Noches Más Negras Por Guarida
423,"Basso,Cristián",¿Por Qué Inventaste La Historia?
424,"Basso,Cristián",Si En La Esquina
425,"Basso,Cristián",Una Lengua De Pájaro
426,"Basso,Cristián",Tropiezo En El Que Soy Y En El Que Fui
427,"Basso,Cristián",Vierte La Carne
428,"Becerra,Luz-Dary",Entre Risas Y Recuerdos Nuestro Paso Se Detiene
429,"Becerra,Luz-Dary",Viejos
430,"Becerra,Luz-Dary",Oh Señor Déjame Refugiar En Tu Morada
431,"Becerra,Luz-Dary",Yo Soy La Luz El Canto La Alegría. El Río. El Árbol... Soy La Vida
432,Bellatrix,Después De Veinte Años...
433,Bellatrix,¡Ella!
434,Bellatrix,Tu Presencia... Volcada Hacia Mí...
435,Bellatrix,¡Y Me Llené De Ti!...
436,"Bermúdez,Leticia",Fiel
437,"Bermúdez,Leticia",Revés
438,"Bermúdez,Leticia",¿Verdad?
439,"Bermúdez,Leticia",Soledad
440,"Bernárdez,Mariana",Lunas Triangulares
441,"Bernárdez,Mariana",El Mundo Nuestro
442,"Bernárdez,Mariana",Ganar Silencio En El Exceso O En La Ausencia
443,"Bernárdez,Mariana",Le Enfilaron Los Whiskies
444,"Bernárdez,Mariana",Tendrás Como Todos Tu Propia Historia
445,"Bersabé,Bernardo",Katrina
446,"Bersabé,Bernardo",Aferrarse Al Tiempo
447,"Bersabé,Bernardo",Aquel Último Baño Del Verano Era La Vida
448,"Bersabé,Bernardo",Tan Sólo De Tu Propio Llanto Eres Dueño
449,"Bersabé,Bernardo",Es Duro Decir Adiós...
450,"Bersabé,Bernardo",Esculpimos Allí
451,"Bersabé,Bernardo",Heridas De La Luz
452,"Bersabé,Bernardo","Hoy, La Luz Llamaba A La Puerta"
453,"Bersabé,Bernardo",Las Cosas Hoy Dispersas Se Reúnen
454,"Bersabé,Bernardo",Rompiendo Horizontes
455,"Bersabé,Bernardo",Parecía Tu Voz
456,"Bersabé,Bernardo","Qué Harás En Esta Noche, Me Pregunto"
457,"Bersabé,Bernardo",Queda Un Rastro De Mí
458,"Bersabé,Bernardo",Salvajemente Juntos
459,"Bersabé,Bernardo",Te Vas Cada Día
460,"Bianchi González,Eduardo",En El Diván De Tus Labios Vivos...
461,"Bignes,Rubén",A Dónde Van Los Sueños
462,"Bignes,Rubén",El Fondo De La Casa
463,"Bignes,Rubén",Justito Sobre La Esquina
464,"Bignes,Rubén",Luna Blanca
465,"Bignes,Rubén",Me Despierto De La Húmeda Noche
466,"Bignes,Rubén",Te Imagino En La Distancia
467,"Biosca,Julio",Qué Bonitas Son...
468,"Biosca,Julio","¡Vosotros, Los Poderosos!"
469,"Biosca,Julio",Ayer No Eras Nada...
470,"Biosca,Julio",Dormiré En Sus Senderos
471,"Biosca,Julio",Nostalgia
472,"Biosca,Julio","Que Nada, Ni Nadie, Engañe Tu Vanidad"
473,"Biosca,Julio",Siembra Silenciosa La Conquista
474,"Biosca,Julio","Sentir, Con Dolor"
475,"Biosca,Julio","Que Difícil Es, Hoy Día"
476,"Biosca,Julio",Créeme Mujer
477,"Biosca,Julio",Oración Para Descreídos
478,"Biosca,Julio",Eres El Mágico Cielo
479,"Biosca,Julio",Recuerdo Juvenil
480,"Biosca,Julio",Estarás En Mis Recuerdos ¡Para Siempre!
481,"Biosca,Julio",La Vida Tranquila
482,"Biosca,Julio",Triste Y Sufriente
483,"Biosca,Julio",Para Siempre...
484,"Biosca,Julio",Te Recuerdo Hermano
485,"Biosca,Julio",Que Mi Esfuerzo Diario
486,"Biosca,Julio",Quisiera Construirte Un Hogar
487,"Biosca,Julio",Si No Lo Remediamos
488,"Blanco,José Antonio",Hablemos
489,"Bloksa Gordo,Belén María",Hoy Te Recuerdo Con Alegría A Pesar De Que La Soledad
490,"Bloksa Gordo,Belén María",Sigo
491,"Bloksa Gordo,Belén María",De Alguna Manera Te Olvidaré
492,"Bloksa Gordo,Belén María",En Estos Días De Lluvia Los Olores Y Los Matices Me Evocan
493,"Bloksa Gordo,Belén María",Lille
494,"Bloksa Gordo,Belén María",En Un Instante Pensé Que Moría; Era Simplemente Que Te Ibas
495,"Bloksa Gordo,Belén María","Mi Amor Por Ti Camina Junto Al Tiempo, Alejándose Como El Viento"
496,"Bloksa Gordo,Belén María",Tardes De Lluvia
497,"Bloksa Gordo,Belén María",Oda A Mi Orquídea
498,"Bloksa Gordo,Belén María",Sirena En Soledad
499,"Bocaz,Orlando","Hermoso Niño, Hermoso Corazón..."
500,"Boer,Miguel Ángel De",Lo Que Ustedes Tienen Que Entender
501,"Boer,Miguel Ángel De",Montand
502,"Boer,Miguel Ángel De",Viejo Muelle...Querido!
503,"Boer,Miguel Ángel De",El Asunto Es Como Lograr
504,"Boer,Miguel Ángel De",Resistencia
505,"Boer,Miguel Ángel De",Uno De Ellos
506,"Boer,Miguel Ángel De",No Olvidarla
507,"Boer,Miguel Ángel De",Uno Cree Que Después De Eso
508,"Boer,Miguel Ángel De",Yunior
509,"Boer,Miguel Ángel De",Tiempo
510,"Bonnevie,Marie-Ange",Cruzaste Mi Camino Por Azar...
511,"Bonnevie,Marie-Ange",Nostalgias
512,"Borao Llop,Sergio",Ayer Fuimos Arena De Desiertos Lunares
513,"Borao Llop,Sergio",Cantamos Porque La Vida Lo Precisa
